{
  "record_type": "catalyst_narrative_risk_record",
  "contract": {
    "contract_id": "urn:catalyst:narrative-risk:contract:canonical",
    "contract_version": "1.10.0"
  },
  "identifiers": {
    "record_id": "urn:uuid:10000000-0000-4000-8000-000000000001",
    "case_id": "urn:uuid:20000000-0000-4000-8000-000000000001",
    "method_id": "urn:catalyst:narrative-risk:method:transparent-heuristic",
    "schema_id": "https://sustainablecatalyst.com/schemas/narrative-risk/record/1.10.0",
    "input_schema_id": "https://sustainablecatalyst.com/schemas/narrative-risk/input/1.10.0",
    "ledger_schema_id": "https://sustainablecatalyst.com/schemas/narrative-risk/evidence-ledger/1.10.0",
    "narrative_map_schema_id": "https://sustainablecatalyst.com/schemas/narrative-risk/narrative-map/1.10.0"
  },
  "generated_at": "2026-07-17T12:00:00+00:00",
  "normalized_input": {
    "claim": "Independent measurements indicate the pilot reduced energy use by approximately 12 percent.",
    "source_type": "official_or_primary",
    "evidence_strength": "strong",
    "uncertainty": "medium",
    "narrative_volatility": "low",
    "stakeholder_pressure": "medium",
    "time_sensitivity": "medium",
    "consequences": "high",
    "review_status": "partly_reviewed",
    "source_count": 2,
    "method_notes": "Use only within the measured pilot boundary and retain the weather-normalization assumptions."
  },
  "evidence_ledger": {
    "ledger_version": "1.10.0",
    "primary_claim_id": "urn:catalyst:narrative-risk:claim:sha256:1111111111111111111111111111111111111111111111111111111111111111",
    "claims": [
      {
        "claim_id": "urn:catalyst:narrative-risk:claim:sha256:1111111111111111111111111111111111111111111111111111111111111111",
        "text": "Independent measurements indicate the pilot reduced energy use by approximately 12 percent.",
        "claim_type": "factual",
        "role": "primary",
        "notes": "The claim is limited to the pilot sites and measured period."
      },
      {
        "claim_id": "urn:catalyst:narrative-risk:claim:sha256:2222222222222222222222222222222222222222222222222222222222222222",
        "text": "The observed reduction is likely to persist under comparable operating conditions.",
        "claim_type": "predictive",
        "role": "supporting",
        "notes": "This supporting claim has less direct evidence than the primary claim."
      }
    ],
    "sources": [
      {
        "source_id": "urn:catalyst:narrative-risk:source:sha256:aaaaaaaaaaaaaaaaaaaaaaaaaaaaaaaaaaaaaaaaaaaaaaaaaaaaaaaaaaaaaaaa",
        "title": "Pilot meter audit",
        "source_type": "peer_reviewed_or_audited",
        "creators": [
          "Energy Audit Team"
        ],
        "publisher": "Independent Audit Group",
        "published_year": 2026,
        "url": "https://example.org/pilot-audit",
        "accessed_at": "2026-07-17T12:00:00+00:00",
        "identifiers": [
          {
            "scheme": "doi",
            "value": "10.0000/example.audit"
          }
        ],
        "independence_group": "independent-audit-group",
        "duplicate_of_source_id": null,
        "directness": "direct",
        "freshness": "current",
        "provenance": {
          "acquisition_method": "document_import",
          "imported_from": "knowledge-library:pilot-meter-audit",
          "imported_at": "2026-07-17T12:00:00+00:00",
          "content_sha256": "aaaaaaaaaaaaaaaaaaaaaaaaaaaaaaaaaaaaaaaaaaaaaaaaaaaaaaaaaaaaaaaa"
        },
        "notes": "Independent audit of weather-normalized meter data."
      },
      {
        "source_id": "urn:catalyst:narrative-risk:source:sha256:bbbbbbbbbbbbbbbbbbbbbbbbbbbbbbbbbbbbbbbbbbbbbbbbbbbbbbbbbbbbbbbb",
        "title": "Utility interval dataset",
        "source_type": "official_or_primary",
        "creators": [
          "City Utility"
        ],
        "publisher": "City Utility",
        "published_year": 2026,
        "url": "https://example.org/utility-data",
        "accessed_at": "2026-07-17T12:00:00+00:00",
        "identifiers": [
          {
            "scheme": "catalog",
            "value": "dataset:utility-interval-2026"
          }
        ],
        "independence_group": "city-utility",
        "duplicate_of_source_id": null,
        "directness": "direct",
        "freshness": "current",
        "provenance": {
          "acquisition_method": "catalyst_data",
          "imported_from": "catalyst-data:utility-interval-2026",
          "imported_at": "2026-07-17T12:00:00+00:00",
          "content_sha256": "bbbbbbbbbbbbbbbbbbbbbbbbbbbbbbbbbbbbbbbbbbbbbbbbbbbbbbbbbbbbbbbb"
        },
        "notes": "Primary interval readings used by the audit."
      }
    ],
    "evidence_items": [
      {
        "evidence_id": "urn:catalyst:narrative-risk:evidence:sha256:cccccccccccccccccccccccccccccccccccccccccccccccccccccccccccccccc",
        "source_id": "urn:catalyst:narrative-risk:source:sha256:aaaaaaaaaaaaaaaaaaaaaaaaaaaaaaaaaaaaaaaaaaaaaaaaaaaaaaaaaaaaaaaa",
        "evidence_type": "finding",
        "excerpt": "Weather-normalized consumption declined 11.8 percent across the pilot sites.",
        "locator": "p. 14",
        "captured_at": "2026-07-17T12:05:00+00:00",
        "excerpt_sha256": "8b1690fa4e70d7b1f71252ebeaaa3badd515eb4f4a46847b4c1d6ccf2ca4ad21",
        "notes": "Audit finding rounded to approximately 12 percent in the claim."
      },
      {
        "evidence_id": "urn:catalyst:narrative-risk:evidence:sha256:dddddddddddddddddddddddddddddddddddddddddddddddddddddddddddddddd",
        "source_id": "urn:catalyst:narrative-risk:source:sha256:bbbbbbbbbbbbbbbbbbbbbbbbbbbbbbbbbbbbbbbbbbbbbbbbbbbbbbbbbbbbbbbb",
        "evidence_type": "data",
        "excerpt": "The interval dataset shows a 12.1 percent reduction relative to the normalized baseline.",
        "locator": "dataset row 18",
        "captured_at": "2026-07-17T12:06:00+00:00",
        "excerpt_sha256": "ccd634214ff2f08b11603a7d685b4169f0aa64a7fd3283fb8e3ebf404d793a6c",
        "notes": "Primary data independently checked against the audit calculation."
      }
    ],
    "relationships": [
      {
        "relationship_id": "urn:catalyst:narrative-risk:relationship:sha256:eeeeeeeeeeeeeeeeeeeeeeeeeeeeeeeeeeeeeeeeeeeeeeeeeeeeeeeeeeeeeeee",
        "claim_id": "urn:catalyst:narrative-risk:claim:sha256:1111111111111111111111111111111111111111111111111111111111111111",
        "evidence_id": "urn:catalyst:narrative-risk:evidence:sha256:cccccccccccccccccccccccccccccccccccccccccccccccccccccccccccccccc",
        "relation_type": "support",
        "strength": "strong",
        "notes": "Direct audited finding."
      },
      {
        "relationship_id": "urn:catalyst:narrative-risk:relationship:sha256:ffffffffffffffffffffffffffffffffffffffffffffffffffffffffffffffff",
        "claim_id": "urn:catalyst:narrative-risk:claim:sha256:1111111111111111111111111111111111111111111111111111111111111111",
        "evidence_id": "urn:catalyst:narrative-risk:evidence:sha256:dddddddddddddddddddddddddddddddddddddddddddddddddddddddddddddddd",
        "relation_type": "support",
        "strength": "strong",
        "notes": "Primary data corroboration from a separate source group."
      },
      {
        "relationship_id": "urn:catalyst:narrative-risk:relationship:sha256:9999999999999999999999999999999999999999999999999999999999999999",
        "claim_id": "urn:catalyst:narrative-risk:claim:sha256:2222222222222222222222222222222222222222222222222222222222222222",
        "evidence_id": "urn:catalyst:narrative-risk:evidence:sha256:cccccccccccccccccccccccccccccccccccccccccccccccccccccccccccccccc",
        "relation_type": "qualify",
        "strength": "limited",
        "notes": "The audit supports persistence only under comparable conditions."
      }
    ],
    "coverage": {
      "per_claim": [
        {
          "claim_id": "urn:catalyst:narrative-risk:claim:sha256:1111111111111111111111111111111111111111111111111111111111111111",
          "evidence_count": 2,
          "source_count": 2,
          "independent_source_count": 2,
          "relationship_counts": {
            "support": 2,
            "qualify": 0,
            "contradict": 0,
            "contextualize": 0,
            "unresolved": 0
          },
          "positive_strength": "strong",
          "coverage_status": "substantial",
          "contested": false
        },
        {
          "claim_id": "urn:catalyst:narrative-risk:claim:sha256:2222222222222222222222222222222222222222222222222222222222222222",
          "evidence_count": 1,
          "source_count": 1,
          "independent_source_count": 1,
          "relationship_counts": {
            "support": 0,
            "qualify": 1,
            "contradict": 0,
            "contextualize": 0,
            "unresolved": 0
          },
          "positive_strength": "limited",
          "coverage_status": "partial",
          "contested": false
        }
      ],
      "overall": {
        "claim_count": 2,
        "source_count": 2,
        "evidence_count": 2,
        "relationship_count": 3,
        "independent_source_count": 2,
        "duplicate_source_count": 0,
        "direct_source_count": 2,
        "stale_source_count": 0,
        "unsupported_claim_count": 0,
        "contested_claim_count": 0,
        "coverage_status": "partial"
      }
    },
    "source_list": [
      {
        "source_id": "urn:catalyst:narrative-risk:source:sha256:aaaaaaaaaaaaaaaaaaaaaaaaaaaaaaaaaaaaaaaaaaaaaaaaaaaaaaaaaaaaaaaa",
        "citation_key": "Team2026-aaaaaaaa",
        "citation": "Energy Audit Team (2026) Pilot meter audit. Independent Audit Group. Available at: https://example.org/pilot-audit (Accessed: 2026-07-17)."
      },
      {
        "source_id": "urn:catalyst:narrative-risk:source:sha256:bbbbbbbbbbbbbbbbbbbbbbbbbbbbbbbbbbbbbbbbbbbbbbbbbbbbbbbbbbbbbbbb",
        "citation_key": "Utility2026-bbbbbbbb",